{
  "format": "2lang/dictionary",
  "version": 1,
  "lang": "es",
  "license": "cc-by-sa",
  "source": "Черновик ИИ (D-25) на частотном каркасе wordhoard v0.1.0 (CC BY-SA 4.0, D-24): https://github.com/natema/wordhoard; см. content/frequency/NOTICE.md",
  "entries": [
    {
      "id": "bueno",
      "lemma": "bueno",
      "pos": "adj",
      "rank": 1,
      "translations": {
        "ru": "хороший; добрый"
      },
      "pair": "en:good",
      "forms": {
        "f": "buena",
        "pl": "buenos",
        "fpl": "buenas"
      },
      "examples": [
        {
          "es": "Es un hotel bueno y barato.",
          "ru": "Это хороший и недорогой отель.",
          "topic": "travel"
        },
        {
          "es": "Buenas noticias: el error está arreglado.",
          "ru": "Хорошие новости: ошибка исправлена.",
          "topic": "it"
        }
      ],
      "note": {
        "ru": "Перед существительным м. р. ед. ч. — buen: un buen hotel"
      },
      "ext": {
        "draft": true
      }
    },
    {
      "id": "mejor",
      "lemma": "mejor",
      "pos": "adj",
      "rank": 2,
      "translations": {
        "ru": "лучше, лучший"
      },
      "forms": {
        "f": "mejor",
        "pl": "mejores",
        "fpl": "mejores"
      },
      "examples": [
        {
          "es": "Es la mejor playa de la isla.",
          "ru": "Это лучший пляж на острове.",
          "topic": "travel"
        },
        {
          "es": "Esta versión es mejor que la anterior.",
          "ru": "Эта версия лучше предыдущей.",
          "topic": "it"
        }
      ],
      "ext": {
        "draft": true
      }
    },
    {
      "id": "nuevo",
      "lemma": "nuevo",
      "pos": "adj",
      "rank": 3,
      "translations": {
        "ru": "новый"
      },
      "pair": "en:new",
      "forms": {
        "f": "nueva",
        "pl": "nuevos",
        "fpl": "nuevas"
      },
      "examples": [
        {
          "es": "Tengo un móvil nuevo.",
          "ru": "У меня новый телефон.",
          "topic": "daily"
        },
        {
          "es": "Instala la nueva versión de la app.",
          "ru": "Установи новую версию приложения.",
          "topic": "it"
        }
      ],
      "ext": {
        "draft": true
      }
    },
    {
      "id": "seguro",
      "lemma": "seguro",
      "pos": "adj",
      "rank": 4,
      "translations": {
        "ru": "уверенный; безопасный"
      },
      "pair": "en:sure",
      "forms": {
        "f": "segura",
        "pl": "seguros",
        "fpl": "seguras"
      },
      "examples": [
        {
          "es": "¿Es seguro el barrio por la noche?",
          "ru": "Безопасен ли район ночью?",
          "topic": "travel"
        },
        {
          "es": "Estoy seguro de que funciona.",
          "ru": "Я уверен, что это работает.",
          "topic": "it"
        }
      ],
      "ext": {
        "draft": true
      }
    },
    {
      "id": "chico-adj",
      "lemma": "chico",
      "pos": "adj",
      "rank": 5,
      "translations": {
        "ru": "маленький (Лат. Америка)"
      },
      "forms": {
        "f": "chica",
        "pl": "chicos",
        "fpl": "chicas"
      },
      "examples": [
        {
          "es": "La habitación es muy chica.",
          "ru": "Номер очень маленький.",
          "topic": "travel"
        },
        {
          "es": "Es un cambio chico en el código.",
          "ru": "Это маленькое изменение в коде.",
          "topic": "it"
        }
      ],
      "ext": {
        "draft": true
      }
    },
    {
      "id": "claro",
      "lemma": "claro",
      "pos": "adj",
      "rank": 6,
      "translations": {
        "ru": "ясный; светлый; ¡claro! — конечно!"
      },
      "forms": {
        "f": "clara",
        "pl": "claros",
        "fpl": "claras"
      },
      "examples": [
        {
          "es": "¡Claro que sí! Te ayudo.",
          "ru": "Конечно! Помогу тебе.",
          "topic": "daily"
        },
        {
          "es": "La habitación es clara y grande.",
          "ru": "Номер светлый и просторный.",
          "topic": "travel"
        }
      ],
      "ext": {
        "draft": true
      }
    },
    {
      "id": "grande",
      "lemma": "grande",
      "pos": "adj",
      "rank": 7,
      "translations": {
        "ru": "большой; великий"
      },
      "pair": "en:big",
      "forms": {
        "f": "grande",
        "pl": "grandes",
        "fpl": "grandes"
      },
      "examples": [
        {
          "es": "Quiero una maleta grande.",
          "ru": "Мне нужен большой чемодан.",
          "topic": "travel"
        },
        {
          "es": "Es un proyecto muy grande.",
          "ru": "Это очень большой проект.",
          "topic": "it"
        }
      ],
      "note": {
        "ru": "Перед существительным в ед. ч. — gran: una gran idea"
      },
      "ext": {
        "draft": true
      }
    },
    {
      "id": "pequeño",
      "lemma": "pequeño",
      "pos": "adj",
      "rank": 8,
      "rules": [
        "es-n-tilde",
        "es-qu"
      ],
      "translations": {
        "ru": "маленький"
      },
      "pair": "en:little",
      "forms": {
        "f": "pequeña",
        "pl": "pequeños",
        "fpl": "pequeñas"
      },
      "examples": [
        {
          "es": "Es un pueblo pequeño junto al mar.",
          "ru": "Это маленький городок у моря.",
          "topic": "travel"
        },
        {
          "es": "Hay un pequeño error en el texto.",
          "ru": "В тексте маленькая ошибка.",
          "topic": "it"
        }
      ],
      "ext": {
        "draft": true
      }
    },
    {
      "id": "último",
      "lemma": "último",
      "pos": "adj",
      "rank": 9,
      "translations": {
        "ru": "последний"
      },
      "pair": "en:last",
      "forms": {
        "f": "última",
        "pl": "últimos",
        "fpl": "últimas"
      },
      "examples": [
        {
          "es": "¿A qué hora sale el último tren?",
          "ru": "Во сколько последний поезд?",
          "topic": "travel"
        },
        {
          "es": "Instala la última actualización.",
          "ru": "Установи последнее обновление.",
          "topic": "it"
        }
      ],
      "ext": {
        "draft": true
      }
    },
    {
      "id": "serio",
      "lemma": "serio",
      "pos": "adj",
      "rank": 10,
      "translations": {
        "ru": "серьёзный"
      },
      "pair": "en:serious",
      "forms": {
        "f": "seria",
        "pl": "serios",
        "fpl": "serias"
      },
      "examples": [
        {
          "es": "Es un problema serio con el pasaporte.",
          "ru": "Это серьёзная проблема с паспортом.",
          "topic": "travel"
        },
        {
          "es": "¿En serio? ¿Otra reunión?",
          "ru": "Серьёзно? Ещё одна встреча?",
          "topic": "it"
        }
      ],
      "ext": {
        "draft": true
      }
    },
    {
      "id": "listo",
      "lemma": "listo",
      "pos": "adj",
      "rank": 11,
      "translations": {
        "ru": "готовый (estar listo); умный (ser listo)"
      },
      "pair": "en:ready",
      "forms": {
        "f": "lista",
        "pl": "listos",
        "fpl": "listas"
      },
      "examples": [
        {
          "es": "¿Estás listo? El taxi está abajo.",
          "ru": "Ты готов? Такси внизу.",
          "topic": "travel"
        },
        {
          "es": "La versión está lista para producción.",
          "ru": "Версия готова к продакшену.",
          "topic": "it"
        }
      ],
      "ext": {
        "draft": true
      }
    },
    {
      "id": "pasado",
      "lemma": "pasado",
      "pos": "adj",
      "rank": 12,
      "translations": {
        "ru": "прошлый"
      },
      "pair": "en:past",
      "forms": {
        "f": "pasada",
        "pl": "pasados",
        "fpl": "pasadas"
      },
      "examples": [
        {
          "es": "El año pasado fuimos a Perú.",
          "ru": "В прошлом году мы ездили в Перу.",
          "topic": "travel"
        },
        {
          "es": "La semana pasada lanzamos la app.",
          "ru": "На прошлой неделе мы выпустили приложение.",
          "topic": "it"
        }
      ],
      "ext": {
        "draft": true
      }
    },
    {
      "id": "único",
      "lemma": "único",
      "pos": "adj",
      "rank": 13,
      "translations": {
        "ru": "единственный; уникальный"
      },
      "pair": "en:single",
      "forms": {
        "f": "única",
        "pl": "únicos",
        "fpl": "únicas"
      },
      "examples": [
        {
          "es": "Es el único hotel del pueblo.",
          "ru": "Это единственный отель в городке.",
          "topic": "travel"
        },
        {
          "es": "Cada usuario tiene un identificador único.",
          "ru": "У каждого пользователя уникальный идентификатор.",
          "topic": "it"
        }
      ],
      "ext": {
        "draft": true
      }
    },
    {
      "id": "junto",
      "lemma": "junto",
      "pos": "adj",
      "rank": 14,
      "translations": {
        "ru": "вместе (juntos); рядом (junto a)"
      },
      "forms": {
        "f": "junta",
        "pl": "juntos",
        "fpl": "juntas"
      },
      "examples": [
        {
          "es": "Viajamos juntos a Italia.",
          "ru": "Мы едем в Италию вместе.",
          "topic": "travel"
        },
        {
          "es": "Trabajamos juntas en el mismo equipo.",
          "ru": "Мы работаем вместе в одной команде.",
          "topic": "it"
        }
      ],
      "ext": {
        "draft": true
      }
    },
    {
      "id": "cierto",
      "lemma": "cierto",
      "pos": "adj",
      "rank": 15,
      "rules": [
        "es-c-before-e-i"
      ],
      "translations": {
        "ru": "верный; некий, определённый"
      },
      "pair": "en:true",
      "forms": {
        "f": "cierta",
        "pl": "ciertos",
        "fpl": "ciertas"
      },
      "examples": [
        {